[
  {
    "plan_id": "florida-state-university",
    "institution_name": "Florida State University",
    "state": "FL",
    "city": "Tallahassee",
    "control": "public",
    "institution_type": "R1 university",
    "system_affiliation": "State University System of Florida",
    "enrollment": 44000,
    "plan_type": "Continuity of Operations Plan (COOP)",
    "document_type": "template",
    "organizing_structure": "essential-functions-based",
    "framework_alignment": "FCD-style continuity elements; all-hazards; FSU Policy 4-OP-E-10 / 4-OP-H-5 / 4-OP-H-10",
    "recency_year": null,
    "published_revised": null,
    "version": null,
    "file_format": "PDF",
    "source_url": "https://emergency.fsu.edu/sites/g/files/upcbnu1431/files/FSU%20COOP_3.pdf",
    "landing_page_url": "https://emergency.fsu.edu/continuity-operations-coop",
    "evidence_quote": "This Continuity of Operations Plan (COOP) based on essential functions, takes an all-hazards approach in preparing for natural, man-made, and technological incidents.",
    "verification": "opened-and-confirmed",
    "date_accessed": "2026-06-17",
    "catalog_notes": "University-published COOP template for units; mandated by FSU Policy 4-OP-E-10. Includes a continuity-of-research section. Administered by the Emergency Management Division.",
    "identifies_essential_functions": true,
    "business_impact_analysis": true,
    "orders_of_succession": true,
    "delegations_of_authority": true,
    "alternate_facilities": true,
    "continuity_communications": true,
    "vital_records": true,
    "defines_rto": true,
    "tt_e_program": true,
    "devolution": false,
    "reconstitution": true,
    "addresses_academic_continuity": false,
    "addresses_it_dr": true,
    "references_fcd1": false,
    "references_nist80034": false,
    "references_iso22301": false,
    "public_redacted_version": false,
    "source_lane": "seed_core"
  },
  {
    "plan_id": "central-georgia-technical-college",
    "institution_name": "Central Georgia Technical College",
    "state": "GA",
    "city": "Warner Robins",
    "control": "public",
    "institution_type": "technical college",
    "system_affiliation": "Technical College System of Georgia",
    "enrollment": 8000,
    "plan_type": "Business Continuity Plan (BCP)",
    "document_type": "full-coop",
    "organizing_structure": "essential-functions-based",
    "framework_alignment": "TCSG Policy II.D Emergency Preparedness, Health, Safety and Security",
    "recency_year": 2024,
    "published_revised": "2024-2025",
    "version": "2024-2025",
    "file_format": "PDF",
    "source_url": "https://www.centralgatech.edu/wp-content/uploads/pdfs/publicsafety/BusinessContinuityPlan.pdf",
    "landing_page_url": "https://www.centralgatech.edu/",
    "evidence_quote": "The intent of the Business Continuity Plan is to guide response and recovery from a major emergency and where appropriate, to be linked or combined with emergency operations procedures.",
    "verification": "opened-and-confirmed",
    "date_accessed": "2026-06-17",
    "catalog_notes": "Institution-wide BCP submitted annually to the TCSG System Office; built on critical mission functions and a hazard vulnerability assessment; exercised and reviewed annually.",
    "identifies_essential_functions": true,
    "business_impact_analysis": false,
    "orders_of_succession": false,
    "delegations_of_authority": false,
    "alternate_facilities": false,
    "continuity_communications": false,
    "vital_records": false,
    "defines_rto": false,
    "tt_e_program": true,
    "devolution": false,
    "reconstitution": false,
    "addresses_academic_continuity": false,
    "addresses_it_dr": false,
    "references_fcd1": false,
    "references_nist80034": false,
    "references_iso22301": false,
    "public_redacted_version": false,
    "source_lane": "seed_core"
  },
  {
    "plan_id": "appalachian-state-university",
    "institution_name": "Appalachian State University",
    "state": "NC",
    "city": "Boone",
    "control": "public",
    "institution_type": "regional public university",
    "system_affiliation": "University of North Carolina System",
    "enrollment": 21000,
    "plan_type": "Continuity of Operations Plan (COOP)",
    "document_type": "business-continuity-framework",
    "organizing_structure": "phase-based",
    "framework_alignment": "FEMA four-phase continuity model",
    "recency_year": 2023,
    "published_revised": "Updated 2023-08-22",
    "version": null,
    "file_format": "HTML",
    "source_url": "https://emergency.appstate.edu/coop",
    "landing_page_url": "https://emergency.appstate.edu/planning-management",
    "evidence_quote": "A Continuity of Operations Plan (COOP), also known as a Business Continuity Plan (BCP) is a collection of resources, actions, procedures, and information that is developed, tested and kept ready in the event of a disruption of operations.",
    "verification": "opened-and-confirmed",
    "date_accessed": "2026-06-17",
    "catalog_notes": "Program page structured around the four FEMA continuity phases (Readiness/Preparedness, Activation, Operations, Reconstitution) with a unit-level Quick Start Guide.",
    "identifies_essential_functions": true,
    "business_impact_analysis": false,
    "orders_of_succession": false,
    "delegations_of_authority": false,
    "alternate_facilities": true,
    "continuity_communications": false,
    "vital_records": false,
    "defines_rto": false,
    "tt_e_program": true,
    "devolution": false,
    "reconstitution": true,
    "addresses_academic_continuity": false,
    "addresses_it_dr": false,
    "references_fcd1": false,
    "references_nist80034": false,
    "references_iso22301": false,
    "public_redacted_version": false,
    "source_lane": "seed_core"
  }
]
